{
  "action_fingerprint": "03c639f9624496cc4326c749447baaf88d206a1dc0f17b62a5bd71217dab3913",
  "blocked_reasons": [],
  "decision_fingerprint": "095491118aacbf233b1118d6187435e0d2af9699a4625ebcdc009674969be708",
  "decision_id": "decision:095491118aacbf233b1118d6",
  "disposition": "REQUIRE",
  "execution_authorized": false,
  "explanation": "A narrow low-risk file mutation requires user confirmation, revalidation, and audit.",
  "generated_at": "2026-01-01T00:00:00Z",
  "matched_rules": [
    "windows.l1-low-risk-file"
  ],
  "policy_version": "windows-default/0.5",
  "preconditions_snapshot": {
    "context_preconditions": {
      "BACKUP_PRESENT": true,
      "ROLLBACK_READY": true
    },
    "scope": {
      "allowed_paths": [
        "C:\\Temp"
      ]
    },
    "targets": {
      "09-stale-consent:target": {
        "facts": {
          "exists": true,
          "is_reparse_point": false,
          "mtime_ns": 100,
          "path": "C:\\Temp\\stale.tmp",
          "sha256": "aaaaaaaaaaaaaaaaaaaaaaaaaaaaaaaaaaaaaaaaaaaaaaaaaaaaaaaaaaaaaaaa",
          "size_bytes": 128,
          "target_type": "file"
        },
        "target_fingerprint": "37a5bf24fff47ec00864b8de299e6266da1fdc771a9099792fae57dfc0c1deaa"
      }
    }
  },
  "request_id": "09-stale-consent:request",
  "requested_effect": "remove one synthetic temp file",
  "requirements": [
    "AUDIT",
    "TARGET_REVALIDATION",
    "USER_CONFIRMATION"
  ],
  "risk_level": "L1",
  "scope_snapshot": {
    "allowed_paths": [
      "C:\\Temp"
    ]
  },
  "target_fingerprints": [
    "37a5bf24fff47ec00864b8de299e6266da1fdc771a9099792fae57dfc0c1deaa"
  ]
}
